{
  "artifacts": [],
  "command": "PYTHONPATH=src .venv/Scripts/python.exe -m pytest tests/test_web_security_policy.py tests/test_api.py -q",
  "counts": {
    "collection_errors": 0,
    "failed": 0,
    "passed": 4,
    "rerun": 0,
    "skipped": 0,
    "xfailed": 0
  },
  "duration_seconds": 2.4,
  "environment": {
    "name": "Windows development host",
    "platform": "Windows-11-10.0.26200-SP0",
    "python": "3.13.14"
  },
  "evidence_id": "69401c2d3f7abe9686b7eb56a0ac85840ab25120d9fa4ecd15771fd0c004f601",
  "inputs": [
    {
      "path": "tests\\test_web_security_policy.py",
      "sha256": "75f9ae21605c0fa0b22605826b5c1ad68394adbcb90c1518aa619846b8881ed6"
    },
    {
      "path": "tests\\test_api.py",
      "sha256": "754851c131d11722e7ef49a1d20634ed8b711fffe5b2a2ea750829764390eeb9"
    }
  ],
  "recorded_at": "2026-08-12T19:53:38.775681Z",
  "result": "passed",
  "revision": "working-tree",
  "schema_version": 1
}
