{
  "artifacts": [],
  "command": ".venv\\Scripts\\python.exe -m pytest -q tests/test_cursor_policy.py",
  "counts": {
    "collection_errors": 0,
    "failed": 0,
    "passed": 1,
    "rerun": 0,
    "skipped": 0,
    "xfailed": 0
  },
  "duration_seconds": 1.0,
  "environment": {
    "name": "H0 emulated aarch64 qualification",
    "platform": "Windows-11-10.0.26200-SP0",
    "python": "3.13.14"
  },
  "evidence_id": "29d8e47450c960d7cbf8b3fc4d03e98cb877067e382c8a0c3793cb934b2717e8",
  "inputs": [
    {
      "path": "tests\\test_cursor_policy.py",
      "sha256": "9adde8269ef79de9efc32e3e24a82a4ecdfe11aff2be62836d96a54c2647b491"
    },
    {
      "path": "src\\sentinel_edge\\projections\\cursor_policy.py",
      "sha256": "3cbea1048c130cdd39c25caced20b6243cd032d3d2c2b0cbe7eef018373a83fd"
    }
  ],
  "recorded_at": "2026-08-13T13:00:38.291807Z",
  "result": "passed",
  "revision": "working-tree-20260813-cur004",
  "schema_version": 1
}
