{
  "artifacts": [],
  "command": ".venv\\Scripts\\python.exe -m pytest -q tests/test_authorization_history.py",
  "counts": {
    "collection_errors": 0,
    "failed": 0,
    "passed": 2,
    "rerun": 0,
    "skipped": 0,
    "xfailed": 0
  },
  "duration_seconds": 1.0,
  "environment": {
    "name": "H0 emulated aarch64 qualification",
    "platform": "Windows-11-10.0.26200-SP0",
    "python": "3.13.14"
  },
  "evidence_id": "86a0028d470a7d704cbacc6adfca72bcd525643f9deb23e979351b3fca3cb273",
  "inputs": [
    {
      "path": "tests\\test_authorization_history.py",
      "sha256": "fd44cdbcacd065e681d23ea8a18967e7bd9f524a42a728ee3ea8b33fe9b4eb86"
    },
    {
      "path": "src\\sentinel_edge\\security\\authorization_history.py",
      "sha256": "f1b376b2a61507cab923129c803f1332779949c173d63ef476d049f69d2f551a"
    }
  ],
  "recorded_at": "2026-08-13T13:02:27.912941Z",
  "result": "passed",
  "revision": "working-tree-20260813-azf004",
  "schema_version": 1
}
