{
  "artifacts": [],
  "command": "PYTHONPATH=src .venv/Scripts/python.exe -m pytest -q tests/test_deferred_risk_registers.py tests/test_g0_gate_status.py tests/test_conformance_ledger_validation.py",
  "counts": {
    "collection_errors": 0,
    "failed": 0,
    "passed": 6,
    "rerun": 0,
    "skipped": 0,
    "xfailed": 0
  },
  "duration_seconds": 15.1,
  "environment": {
    "name": "Windows development host",
    "platform": "Windows-11-10.0.26200-SP0",
    "python": "3.13.14"
  },
  "evidence_id": "a4f252bcba1420e6773bd7e568b965d4b3c1a0b3bcc65188ce751c8410a7c600",
  "inputs": [
    {
      "path": "tests\\test_deferred_risk_registers.py",
      "sha256": "daefdb0e9d37f29d5f8757bab9de5503e7436d8c5c248452844fbbc208da6324"
    },
    {
      "path": "tests\\test_g0_gate_status.py",
      "sha256": "78ce9e39f7c7e517acfe5bbf240e2a2426801f0b6a3bead1bb74053dc5532ed8"
    },
    {
      "path": "tests\\test_conformance_ledger_validation.py",
      "sha256": "8c85cf4cad9a4d66a881dcae260a0dd42e640b35dec90dc5e4f00dbd88ab5ea6"
    }
  ],
  "recorded_at": "2026-08-13T03:37:06.852545Z",
  "result": "passed",
  "revision": "working-tree",
  "schema_version": 1
}
