{
  "artifacts": [
    {
      "path": "docs\\IMPLEMENTATION_STATUS.md",
      "sha256": "7099278989b59d775f5d06f380fbd3ffc7106302eaad63e8d22fea19695435ba"
    }
  ],
  "command": "PYTEST_DISABLE_PLUGIN_AUTOLOAD=1 python -m pytest -q --tb=short -W error::pytest.PytestUnraisableExceptionWarning",
  "counts": {
    "collection_errors": 0,
    "failed": 0,
    "passed": 319,
    "rerun": 0,
    "skipped": 0,
    "xfailed": 0
  },
  "duration_seconds": 372.1,
  "environment": {
    "name": "Windows 11 / Python 3.13.14 / local development host",
    "platform": "Windows-11-10.0.26200-SP0",
    "python": "3.13.14"
  },
  "evidence_id": "1e51a40279e6e95cf36d1509598f639037acb644ee2e802a5b7b3b1547e1a02d",
  "inputs": [
    {
      "path": "pyproject.toml",
      "sha256": "c7668f665d154d3bb9604b1e38f8f29df218de53854cf95bd874d66e0dcc152f"
    },
    {
      "path": "registries/requirements.yaml",
      "sha256": "2a7880979726547cd029a89f97fd35ed50a58881c99a43de8fd8a8150f4b7b54"
    }
  ],
  "recorded_at": "2026-08-12T04:46:10.229913Z",
  "result": "passed",
  "revision": "HEAD",
  "schema_version": 1
}
