{
  "artifacts": [
    {
      "path": "qualification\\scope-freeze.json",
      "sha256": "31d9467564e1d6cb4a7fbe5a2eb8f1899b40804119770f9f83ac85df5b33753a"
    },
    {
      "path": "qualification\\deferred-debt-register.json",
      "sha256": "4600d1f03f1eb914df7ed2f8b2bea6b40df5b3b1ac889279ec1255d4366984e7"
    },
    {
      "path": "qualification\\residual-risk-register.json",
      "sha256": "53177282149233228cc89ddbeedd9f0dbfe5b0b1612c90cd6a7610aea7508aef"
    }
  ],
  "command": "PYTEST_DISABLE_PLUGIN_AUTOLOAD=1 python -m pytest -q tests/test_scope_freeze.py tests/test_deferred_risk_registers.py tests/test_traceability.py tests/test_command_catalog.py tests/test_conformance_ledger.py tests/test_conformance_ledger_validation.py --tb=short",
  "counts": {
    "collection_errors": 0,
    "failed": 0,
    "passed": 12,
    "rerun": 0,
    "skipped": 0,
    "xfailed": 0
  },
  "duration_seconds": 16.4,
  "environment": {
    "name": "Windows 11 / Python 3.13.14 / local development host",
    "platform": "Windows-11-10.0.26200-SP0",
    "python": "3.13.14"
  },
  "evidence_id": "b9c1f07425f8dfd695fac7f28f902c865c791a145e0514e09f9c83714e0508d9",
  "inputs": [
    {
      "path": "architecture\\command-catalog.yaml",
      "sha256": "8d7d670d6f8df46ecb91b92f87fc8ab19b4aa05116cbe178bab8d5bc3b09bbd8"
    },
    {
      "path": "registries\\requirements.yaml",
      "sha256": "8b91caf0b6c43e81c5f038f7ed8249b20baa6a14b3871b1fd9d484f15604b90c"
    },
    {
      "path": "registries\\uncertainties.yaml",
      "sha256": "25faf25260add3d8c1c2acef26b83ba61f2315767121820b202683b233841019"
    }
  ],
  "recorded_at": "2026-08-12T05:09:08.047528Z",
  "result": "passed",
  "revision": "HEAD",
  "schema_version": 1
}
