{
  "artifacts": [],
  "command": "PYTHONPATH=src .venv/Scripts/python.exe -m pytest -q tests/test_evidence_governance.py tests/test_applicability_domain.py tests/test_drift_governance.py",
  "counts": {
    "collection_errors": 0,
    "failed": 0,
    "passed": 9,
    "rerun": 0,
    "skipped": 0,
    "xfailed": 0
  },
  "duration_seconds": 1.5,
  "environment": {
    "name": "Windows development host",
    "platform": "Windows-11-10.0.26200-SP0",
    "python": "3.13.14"
  },
  "evidence_id": "44552335c3becb7773907af2a9f12709aea13e9817f829b4025bc80c3cfdda83",
  "inputs": [
    {
      "path": "tests\\test_evidence_governance.py",
      "sha256": "f585d428a6ea383875fe18851e32b639da572e2a20bd9c064455c6a38b599895"
    },
    {
      "path": "tests\\test_applicability_domain.py",
      "sha256": "2b5aeebb286839335453710eff4f89d2d2f1cfc03ca528b5be502cb4ff491319"
    },
    {
      "path": "tests\\test_drift_governance.py",
      "sha256": "6ba6df805c7c2611a6472997889bf82b52c98cb5ccdb14780b0d20cbd44c869a"
    }
  ],
  "recorded_at": "2026-08-13T03:53:41.323700Z",
  "result": "passed",
  "revision": "working-tree",
  "schema_version": 1
}
