{
  "artifacts": [
    {
      "path": "src\\sentinel_edge\\collaboration\\fixture.py",
      "sha256": "99873ecb7d98bde32ef29a3b7273dd8c01a432fbd611e61db671df71d5aafc4d"
    }
  ],
  "command": ".venv\\Scripts\\python.exe -m pytest -q tests/test_collaboration_fixture.py tests/test_collaboration_privacy.py tests/test_collaboration_config_validation.py tests/test_collaboration_policy.py tests/test_collaboration_wire.py",
  "counts": {
    "collection_errors": 0,
    "failed": 0,
    "passed": 16,
    "rerun": 0,
    "skipped": 0,
    "xfailed": 0
  },
  "duration_seconds": 4.8,
  "environment": {
    "name": "local deterministic collaboration fixture",
    "platform": "Windows-11-10.0.26200-SP0",
    "python": "3.13.14"
  },
  "evidence_id": "834cce3cdb1bdd1a42ec7e6f2f0fa2e0250c907f877704d47923e3aeeadd2157",
  "inputs": [
    {
      "path": "src\\sentinel_edge\\collaboration\\fixture.py",
      "sha256": "99873ecb7d98bde32ef29a3b7273dd8c01a432fbd611e61db671df71d5aafc4d"
    },
    {
      "path": "tests\\test_collaboration_fixture.py",
      "sha256": "efe3f3e121b9f4ac7b6af2b04768080d2c8b5c003bfb4ed67e3dd735c2bea488"
    }
  ],
  "recorded_at": "2026-08-13T10:09:57.970262Z",
  "result": "passed",
  "revision": "collaboration-fixture-publisher-v1-20260813",
  "schema_version": 1
}
